{
  "claim_class": "public_development",
  "commands": [
    "audit",
    "baseline",
    "null-evaluate",
    "treewidth-audit"
  ],
  "config_id": "indusbench-public-development-v0.1",
  "entrypoint": "indusbench.cli:main",
  "metrics": [
    "baseline.heldout",
    "baseline.missing_sign",
    "leakage.has_leakage",
    "null.empirical_comparison",
    "treewidth.null_comparison"
  ],
  "network_access_required": false,
  "notes": "Public structural development checks only. This configuration is not a blind or final decipherment evaluation and does not define hidden-set custody.",
  "random_seeds": [
    0,
    1,
    2,
    3,
    4,
    5,
    6,
    7,
    8,
    9
  ],
  "schema_version": "0.1.0"
}
